text,importance,label
lifepoint in 11 billion province deal new york reuters  rural hospital operator lifepoint  hospitals inc ltlpntogt has agreed to acquire rival province  healthcare co ltprvngt for 1125 billion in cash and stock to  broaden its geographic reach the companies said on monday,0.0257936640049062,2
cyberonics 39 shares jumps on stock buy advanced neuromodulation systems inc reported friday that it purchased 35 million shares of cyberonics inc taking a 149 percent stake in the houstonbased medical device maker and expressed an interest in combining the two companies,-0.0058680625517078,2
reporting to work midflight business travelers will soon take advantage of airborne internet if two companies have their way boeing and software maker ipass plan to use satellite and wifi to connect high fliers to the office,-0.0778314208503987,2
french output steps up the pace europes bigger economies register yet more productivity growth while the uk starts to fall behind,0.0431989213285208,2
arch coal triton acquisition completed washington reuters  arch coal inc lta href targetstocksquickinfofullquotegtacinltagt said on  friday it had completed the acquisition of rival triton coal  co after a us appeals court denied the governments bid to  block the deal,0.0617002466220428,2
us july output up factories run faster washington reuters  us industrial output advanced in  july as american factories operated at their highest capacity  in more than three years a federal reserve report on tuesday  showed,0.0538677654490095,2
competition rules could scupper abbey deal the spanish bank poised to take over britain 39s abbey national will walk away if the 82bn 121bn deal is stalled by competition concerns it was reported today,0.0372170625910023,2
nikkei ends flat oil concerns weigh tokyo reuters  tokyo stocks ended flat on friday as  worries about recordhigh oil prices took the edge off  investors appetite for recently battered technology issues  such as sharp corp,0.0442229907464771,2
sec bars some mutual fund fees reuters reuters  the us securities and exchangecommission barred us mutual funds on wednesday fromchanneling brokerage commissions toward wall street firms basedon their promotion of the funds shares,0.0764472306935114,2
china mobile reports jump in profits china 39s largest cell phone service provider china mobile hong kong ltd reported a 78 percent jump in firsthalf profits wednesday as its number of subscribers rose by 23 percent,0.0530809685488742,2
google stockowner for a day a memoir if only the rest of my investments worked out this way one week ago i submitted a bid for google inc stock that overestimated the eventual auction price of the computer search companys initial public offering by nearly 30 percent but i sold my shares shortly after google stock began trading yesterday and still walked away with a nice profit,0.017090944673412,2
delta plan includes job and wage cuts the muchawaited  39transformation plan 39 for delta air lines inc one of tampa international airport 39s largest carrier will include further job cuts wage and benefit reductions and a new strategy that will help delta revitalize its entire business,0.0333223593766165,2
stocks near flat j j pressures dow new york reuters  us stocks were little changed on  tuesday with oil prices dropping below 42 a barrel helping to  support markets but johnson   johnson lta href targetstocksquickinfofullquotegtjnjnltagt put pressure on  the dow following a report of a possible 24 billion takeover  of cardiovascular device maker guidant corp lta href targetstocksquickinfofullquotegtgdtnltagt,0.022560042500814,2
parmalat sues us bank csfb italian food giant parmalat is pushing ahead with plans to sue its former auditors by taking csfb to task over a bond deal back in 2002,0.0649361667660038,2
somethings brewing at diedrich coffee the starbucks competitor will sell its international franchise business to battle at home,0.045320492788134,2
quality gets swept away quality distribution is hammered after reporting a large loss for the second quarter,0.1345337155790776,2
it alligator tales i grew up in new york where giant alligators  sometimes more ornately described as albino alligators  were rumored to roam the citys sewer systems according to legend vacationers picked up the tiny crocodilians in florida brought them home to new york and eventually flushed the little buggers when they grew too big for the local concrete jungle,-0.0277522740035118,2
google auction begins on friday an auction of shares in google the web search engine which could be floated for as much as 36bn takes place on friday,-0.0332831321434664,2
oil barrels toward 50 next stop fifty bucks analysts said crude futures could climb that high today pushed to the psychological barrier of 50 us a barrel by speculative buying amid escalating threats to iraq 39s oil infrastructure,0.0492599992147458,2
oil marches toward  3650 weighs on stocks reuters reuters  oil prices marched toward  3650 abarrel on friday weighing on asian stock markets as investorsfretted over the impact of high energy costs on corporateprofits consumer spending and economic growth in general,0.0472424483442538,2
post911 mergers brought problems government service firms often leaped before they looked as they scrambled to buy their way into the booming intelligence and antiterrorism field  ltfont faceverdanams sans serifarialhelvetica size2 color666666gtltbgtthe washington postltbgtltfontgt,0.0131583874644701,2
krispy kreme coo leaves for new job chicago reuters  krispy kreme doughnuts inc  lta href targetstocksquickinfofullquotegtkkdnltagt  said on monday that its chief operating officer is leaving the  company for another job the latest setback for a company that  is trying to recover from sluggish sales and an accounting  probe,0.0318696161248789,2
state 39s hospitals can get money if illegal immigrants give status during the next four years hospitals in the state of washington could be reimbursed nearly 13 million for emergency care they provide to uninsured illegal immigrants,-0.0356849064841059,2
sec orders mutual funds to cease incentive pay the securities and exchange commission yesterday ordered mutual funds to stop paying higher commissions to brokers who promote the companies 39 funds the agency also required portfolio managers to reveal investments in funds they,0.0899786389421588,2
hundreds of fleet layoffs expected bank of america corp plans to lay off hundreds of tellers and other branch employees at fleet banks today asking them to leave the building immediately as part of the process according to documents obtained by the globe and fleet branch managers told of the decision,0.0427665408360914,2
nikkei ends down oil worries weigh tokyo reuters  tokyo stocks ended slightly lower on friday as worries about recordhigh oil prices took the edge off investors 39 appetite for recently battered technology issues such as shinetsu chemical co ltd,0.049684179520416,2
fda approves lung cancer drug washington  the food and drug administration yesterday approved a cancer drug made by pharmaceutical giant eli lilly and co to treat advanced nonsmall cell lung cancer in patients who have undergone chemotherapy,0.0179194934865906,2
citigroup bond trading investigated by uk regulator update1 aug 18 bloomberg  citigroup inc the world 39s biggest bank is being investigated by the uk market regulator over unusual trading activity 39 39 in european government bonds earlier this month,0.0522218002050095,2
hbos in talks to fund 8bn abbey bid hbos is said to be in talks with potential financial backers over how to fund an 8bn takeover bid for abbey national in a move to break up a takeover plan from spain 39s banco santander central hispano,0.0281625532296247,2
nestle reports first half net profit nestle the world 39s biggest food and drink company on wednesday posted a firsthalf net profit of 228 billion up 002 percent on the yearearlier figure of 203 billion,0.0575673427717056,2
edwards blasts new ot rules in saturday radio address vp candidate says measure curtails pay at a time workers need it atlanta cnn  calling to mind his days unloading tractor trailers during the summer sen john edwards blasted,-0.0612268404295667,2
air canada 39s creditors approve plan ready to fly the airline plans to emerge from court shelter on sept 30  if the justices overseeing its restructuring gives the ok at a hearing set for monday,0.0788979664230632,2
united airlines likely to terminate pension plans nited airlines said today that it was likely to terminate and replace its four employee pension plans with lessgenerous benefits a drastic move that the airline said was necessary to attract the financing that would allow it to,0.0450342503646173,2
borders profits rise raises outlook new york reuters  borders group inc lta href targetstocksquickinfofullquotegtbgpnltagt the no 2  us bookseller on tuesday said quarterly earnings rose  beating estimates by the company and wall street largely  because of strongerthanexpected book sales,0.0368705425127144,2
overtime law clarification is hard to figure depending on who is doing the analysis either an additional 13 million american workers will be eligible for overtime beginning tomorrow or 6 million will be stripped of that right,0.0358751414908884,2
nikkei falls over 1 pct on oil worries tokyo reuters  tokyos nikkei fell more than one percent  by midmorning on monday as investors stepped up selling of  exporters such as toyota motor corp amid growing fears of the  impact of surging oil prices on the global economy,-0.0214088635774368,2
us court rejects movie music makers piracy claims los angeles reuters  a federal appeals court on thursday  delivered a stinging blow to the antipiracy efforts of major  movie studios and music companies ruling that several online  filesharing software companies are not liable for copyright  infringement,0.0381897055216168,2
ing to withdraw 5 bln from janus funds new york reuters  ing us financial services said late on tuesday it will withdraw about 5 billion from janus capital group inc funds by yearend,0.0604524250505582,2
earnings climb 62 at hormel foods he hormel foods corporation posted a 62 percent increase in quarterly profit yesterday though higher grain costs kept profit below analysts 39 expectations,0.0371900477805198,2
advanced neuromodulation initiates merger talks with cyberonics new york august 20 new ratings  advanced neuromodulation systems inc ansinas has acquired a 149 equity stake in cyberonics inc cybx while initiating talks for combining the two companies,-0.0090940598913746,2
us economic outlook dims a bit washington reuters  the us economic outlook dimmed  somewhat on tuesday after reports said business productivity  grew more slowly in the third quarter than first estimated  labor costs rose and other indicators signaled softening  activity,0.0036069248438011,2
army in shift will pay halliburton the army reversed a decision to withhold payment on 15 percent of future payments to the halliburton company on its contracts in iraq and kuwait,0.0488018409303777,2
whats google minus 10 billion google drops its price and shares offered its magic turning the hottest ipo in history into a disaster,0.0490109418016612,2
strategies for a sideways market reuters reuters  the bulls and the bears are in thistogether scratching their heads and wondering whats going tohappen next,0.0131149569313096,2
rescuing an old saver if you think you may need to help your elderly relatives with their finances dont be shy about having the money talk  soon,0.0158759346983068,2
truckers 39 stir evokes mixed response new delhi aug 21pti the indefinite nationwide truckers 39 strike protesting the imposition of service tax today evoked mixed response with a section of transporters in karnataka and tamil nadu staying away from the protest,-0.0291415740022363,2
update 1sec nasd probing jefferies trader 39s gifts wsj us market regulators are looking into whether a jefferies group inc jefn quote profile research trader violated rules that prohibit expensive giftgiving in a bid to curry,0.0376483506979311,2
the internet is calling web phone service is exploding and maverick jeffrey citron lit the industrys fuse,-0.0316933944771734,2
halliburton says army can withold payments halliburton co on tuesday blamed politics for a us army decision to not grant the company more time to resolve a billing dispute in which the pentagon contends the company did not adequately account for some 18 billion of work done in the middle east,0.0231909845617821,2
dollar slips to new low vs euro new york reuters  the dollar fell to a new record low  against the euro on tuesday as investors tiring of tough talk  on exchange rates by european officials dismissed new   warnings from euro zone officials,0.0633799954731464,2
housing starts rebound sharply in july washington reuters  housing starts rebounded sharply in july making up almost all the ground lost in a june slump by posting their largest monthly percentage gain since september 2002 a report from the commerce department on tuesday showed,0.041105220708203,2
overtime rules change i have been talking about this for a month and i am finally starting to see more stories about the remarkable changes that begin today,0.0250388773192899,2
stock scheme sweeping nation new york cnnmoney  investors beware if a wily female apparently believing she 39s calling someone else leaves a message with you advising of a hot stock tip walk away according to the securities and exchange commission it 39s a scam,0.0464934259029854,2
oft invites comment on telegraph deal the office of fair trading has set the clock ticking on the process that could see the barclay brothers 39 deal to buy the daily telegraph reviewed by competition watchdogs,0.0423989195746814,2
la parking company lands contract renewal with abia los angelesbased ampco system parking has received a multiyear contract renewal with austinbergstrom international airport,0.0435744340997614,2
in mr bushs neighborhood a peculiar intersection the relationship between president bush and wall street has always been a tangled one layered with paradox and outright contradiction,0.0723731800668738,2
tjx cos earnings fall 4 percent tjx cos inc 39s secondquarter earnings fell 4 percent reflecting higher markdowns on merchandise due to softer sales trends,0.0445859280641854,2
update 4 two firms cleared of swapping violations in a judicial blow to the entertainment industry a federal appeals court ruled that makers of two leading filesharing programs are not legally liable for the songs movies and other copyright works their users swap online,0.0429546255418671,2
update 1 cyberonics 39 shares jump on stock buy advanced neuromodulation systems inc reported friday that it purchased 35 million shares of cyberonics inc taking a 149 percent stake in the houstonbased medical device maker and expressed an interest in combining the two companies,-0.0029205695647809,2
agfagevaert photo pioneer to sell film and lab business russels aug 19  agfagevaert one of the oldest names in the photography business said on thursday that it was selling its consumer film and photo labs business to the team running it to focus on its more profitable medical imaging and,0.0223909977081449,2
puc delays decision to shift power costs here san diego gas  amp electric co customers won a reprieve yesterday when the state utilities commission delayed a decision that could shift 1 billion in crisisrelated power costs to local consumers and cause a major rate increase,0.0236610733732184,2
bangladesh wins 2bn india deal indian conglomerate tata is to invest 2bn in a power plant in bangladesh the countrys single largest foreign investment ever,0.0364758597304542,2
qantas in talks with singapore air on a380 cost cuts sydney australia 39s flagship carrier qantas said yesterday it is talking with singapore airlines on ways to cut costs as both prepare to roll out the colossal a380 jet,0.0540362141161048,2
cox directors look at proposed buyout cox communications inc is a step closer to going private with the cable giant 39s board of directors forming a special committee of independent directors to consider the cox enterprises inc proposal to take the company private in a 79 billion buyout,0.0420242495531934,2
nordstrom profit up but shares fall new york reuters  upscale department store chain  nordstrom inc lta href targetstocksquickinfofullquotegtjwnnltagt said on thursday quarterly earnings rose  62 percent as it controlled inventory and reduced expenses but  the results fell short of wall streets expectations,0.0303918663450657,2
mylan shares spike on interest by icahn philadelphia aug 19 reuters  shares of mylan laboratories inc myln quote profile research surged more than 10 percent on thursday after billionaire investor carl icahn got federal regulatory approval to buy up 119 percent of,0.0400782763867606,2
restoration hardware names tate coo tate who will also become executive vice president of the corte maderabased home furnishings chain was most recently the operating chief at krispy kreme doughnuts inc,0.0542154580939203,2
for sale the ultimate status symbol with the country in need of cash and rich people dying to show off their wealth mr stein proposes a unique solution having the government sell titles of nobility,0.0293470662024091,2
weak version of most powerful explosions found spacecom spacecom  gammaray bursts are the most powerful events in the universe temporary outshining several galaxies and likely signaling the birth of a black hole,0.0965221116852916,3
storage servers brings down hp results hewlettpackard blindsided analysts with news that its third and fourthquarter earnings would badly miss estimates primarily because of problems in its server and storage division,0.0691151596327558,3
new tool identifies phishy web sites a new software tool from wholesecurity inc can spot fraudulent web sites used in online cons known as phishing scams according to a statement from the company,0.076292164913263,3
celebrity chefs are everywhere in vegas by adam goldman    las vegas ap  the waiter appears tableside in the cozy dining room laden with oil paintings stained glass and hints of cherry and oak before reciting the days special menu items he recounts the restaurants devotion to farmfresh produce and tosses out a morsel about its namesake chef bradley ogden,-0.0003010668568215,3
push to talk meets wifi fcc says cellular carriers are working on extending the walkietalkie feature to wifi networkswhich could mean to voip phones,0.1160017909395087,3
ibm 39s new midrange server allows multiple os environments ibm 39s new eserver allows users to run multiple os environments at the same time to increase efficiency customers can purchase the machine based on the processing power they need the server comes in configurations from one to fourway and,0.0511668181491252,3
indian british scientists working on drug to fight malaria at least 27 people are reported to have died of malaria in alindra india and 293 are seriously ill with the disease which broke out after the heavy rains and floods,-0.0333869792926296,3
real launches freedom of choice campaign maccentral maccentral  realnetworks will tout its new windowsonly harmony technology which allows files from its music store to be played on apples ipod in a series of print radio and online advertising the company said in a statement on tuesday in addition real will hold what it calls the biggest music sale in history selling songs for us 36049 and albums for  36499,0.0054540384749279,3
ibm to round out iseries power5 server family big blue is set to debut the eserver i5 550 an iseries machine it created to serve midsize businesses,0.0505876299017581,3
plan for global observation would aid in forecasting of disasters washington  what if scientists could forecast texas floods a full year in advance or predict when and how air pollution from asia or mexico will settle over los angeles or houston or pinpoint the location of the next west nile virus,0.0724454932794359,3
microsoft time warner drm buy on eu review shelf regulators could still launch an investigation into the two titans acquisition of contentguard this month,0.0773277442881344,3
shuttle repair plan remains in the works the space shuttle may begin flying before nasa has a reliable plan to fix damage similar to that which doomed the columbia shuttle in february 2003 the manager of the shuttle program said monday,0.0673901904259201,3
maxtor ships multimediafriendly drive the new diamondmax 10 drives are designed to help people run multiple applications such as games and music without overwhelming their pc system,0.1156887258082574,3
dvd player profits down to 1 want to get into the market for dvd players intense competition and standardization mean that you might make more as a mime,0.1115257979390981,3
wholesecurity takes phishblocking to browser wholesecurity inc has released technology that the firm says can be used to block web users from inadvertently accessing phishing web sites the company has signed ebay inc as a flagship customer and has the software on millions of desktops,0.0482910040210997,3
win xp update a quiet start little fallout reported from service pack but maybe its because everyones being cautious,0.1068917194428858,3
mozilla thunderbird reaches 10 an anonymous reader writes  quotmozilla thunderbird 10 is now available for download on mozilla 39s ftp server quot here is the press release announcing the release,0.0468890329226821,3
ca acquires pestpatrol over the past year spyware has become an increasing problem every time that you visit a web site you must run the gauntlet of a variety of popup adverts any of which can be programmed to place spyware on your computer,0.0653469058795612,3
micro focus lifts and shifts cobol to linux micro focus has extended its  39lift and shift 39 legacy cobol migration service adding the option of migrating cicsbased mainframe cobol applications to hp and ibm unix and linux servers,0.0609212919543663,3
hackers revive itunes music sharing a group of anonymous programmers has released new software that allows music to be swapped via apple computer 39s popular itunes jukebox,0.1072944538801513,3
web sites agree to be accessible to blind ap ap  in one of the first enforcement actions of the americans with disabilities act on the internet two major travel services have agreed to make sites more accessible to the blind and visually impaired,0.05869775502819,3
catching meth cooks pinkhanded wichita kan  it may fall a shade shy of catching thieves redhanded but for farmers fed up with methamphetamine cooks filching their fertilizer staining them pink will do just fine,0.0621442114382436,3
malaysia turtle nesting sites at risk scientists kijal malaysia aug 18 reuters  malaysia once a major breeding ground is in danger of losing its oceanroaming leatherback turtles as humans eat their eggs trap them in fishing nets and encroach on nesting sites scientists said on,0.0730285118775427,3
ford scraps oraclebased purchasing system car giant ford is reportedly abandoning a 200m webbased purchasing project because it can 39t get the software to work properly,0.0884005522675237,3
cassinihuygens discovers two new saturnian moons the cassinihuygens spacecraft a joint project of the us space administration nasa the european space agency esa and the italian space agency asi has discovered two more small moons orbiting the planet saturn bringing the total to 33,0.0560440404242341,3
end of the line for hps alpha processor hewlettpackard co will release the final processor upgrade for its alphaserver line of unix servers on monday,0.101313801293399,3
party crasher forbescom forbescom  not long ago most corporate computer managers viewed opensource programs like mysql as toys fit only for hobbyists but then linux an opensource operating system became a smash hit in corporate sites now the folks who embraced linux are snapping up other bargain programs such as apache which serves up web pages the mysql database and scripting languages like php perl and python which are used to create web pages so many companies use the combination of linux apache mysql and php or perl or python that theyre described with the acronym lamp,0.0428438136761714,3
update 1 toshiba memorytech develop new dvd two japanese companies said tuesday they have developed a dvd that can play on both existing machines and the upcoming highdefinition players raising hopes for a smooth transition as more people dump old tv sets for better screens,0.0731053697983,3
ea video game  39madden 39 tops 13 million first week quotmadden nfl 2005 quot the latest version of electronic arts inc 39s ertso pro football video game franchise sold more than 13 million copies in its first week of release the company said on thursday citing internal figures,0.0411204525994089,3
microsoft lists apps affected by xp sp2 ziff davis ziff davis  microsoft has published a list of nearly 50 software programs that require tweaking in order to work with its most recent windows update,0.083845624535063,3
lenovo may be in acquisition talks with ibm ap ap  chinas biggest computer maker said tuesday it is in acquisition talks with a major international technology company a disclosure which comes amid reports it might buy ibm corps personal computer business,0.0607935404037183,3
google 39s ups and downs google 39s longawaited public offering finally made it to the street but the search is still on for microsoft 39s windows update,0.045473155699136,3
last call for investors to bid on google reuters reuters  time is running out for prospectiveinvestors to submit their offers to buy shares of google incgoogo the webs no 1 search company,-0.0012393248355733,3
