text,importance,label
indictment said issued in colo scandal ap ap  a state grand jury has handed down an indictment regarding the use of prostitutes to entice football recruits to the university of colorado according to a published report,0.0608849821881383,1
result knot all bad for us wins group after tie with aussies athens  playing without suspended forward abby wambach the us women 39s soccer team battled to a mutually beneficial 11 draw with australia last night at kaftanzoglio stadium in thessaloniki the result was not unexpected as the,0.0774684754772656,1
moyo knocked out women prosper athens reuters  gold medal favorite carlos moya joined  the exodus of big name tennis players from the olympics on  thursday crumbling in the mens quarterfinals against chiles  nicolas massu,0.0691551935637285,1
bekele wins 10000m gold as gebrselassie 39s era ends kenenisa bekele stormed to the men  39s 10000 meters title as his once allconquoring fellow ethiopian haile gebrselassie ended at the olympic games on friday night,0.0344214407095335,1
phelps quest to win 8 gold medals ends ap ap  michael phelps surely didnt bargain for this his quest to win eight gold medals is over doomed by americas worst showing in the 400meter freestyle relay gary hall jr is ticked off and now comes the toughest race of all against ian thorpe not exactly what phelps had in mind when he decided to challenge mark spitz,0.0473639828114828,1
coyotes resign rw johnson to threeyear deal  glendale arizona ticker  mike johnson missed most of last season after undergoing shoulder surgery but that didn 39t stop the phoenix coyotes from giving him the veteran right wing a threeyear contract,0.0979402764892433,1
jones leads cowboys to stunning win over seahawks julius jones scored on a 17yard touchdown run with 37 seconds left as the dallas cowboys scored two touchdowns in the last two minutes to stun the seattle seahawks 4339 in the national football league monday,0.0190577121861178,1
eriksson aims to stick by core of euro 2004 side slaley england aug 17 reuters  england coach svengoran eriksson says he is prepared to put his faith in the nucleus of the squad that flopped at euro 2004 as he tries to plot a successful challenge for the world cup,0.0243609662441359,1
sutton 39s ryder cup selections are solid milwaukee wis  hal sutton will get secondguessed which is the main byproduct of the captain of ryder cup teams having two atlarge selections and one month before the 35th version of the matches are played at oakland hills country,0.0718860842690051,1
olerud bails out loaiza in his latest bungled audition john olerud reveled in his return to safeco field by slapping a tworun single that lifted the yankees and saved esteban loaiza from a defeat,0.0753937327846577,1
carter out for season for seminoles ap ap  florida state tight end donnie carter will miss the upcoming season with a torn right knee ligament coach bobby bowden said saturday,0.1139157003518822,1
mustsee tv lacks musthave buzz empty seats in athens offer a bizarre television backdrop for the olympics  one that cannot be avoided by nbc,0.0326176239050397,1
olympicsfederer 39s olympic dream shattered twice over athens aug 17 reuters  world number one roger federer 39s top target for the year  an olympic tennis gold medal  was taken away from him in a  quotterrible day quot on tuesday,0.0737201188523505,1
philo is in the know normally there are few sure things in golf but heres something we can be certain of the lads in todays final pairing at the 84th new england pga championship at brae burn country club will not require introductions,0.0644309985826782,1
keller leads relay upset of aussies athens  klete keller says he likes to run with the bulls talks a little bull too but he doesn 39t kid around in the water,0.0426043516759026,1
phelps pushes goldmedal haul to three athens greece  with the quest to surpass mark spitz out of the way michael phelps could savor one of the greatest races in swimming history phelps claimed his second and third gold medals of the athens games on tuesday winning the,0.0588168952813254,1
brazilian soccer brings joy to haiti portauprince haiti aug 18  so far this year haiti has endured an armed insurrection that killed 300 people and toppled a president and floods that wiped out entire villages with no relief from the grinding misery that comes,-0.03604130108902,1
tigers edge mariners in 11 wild innings ap ap  craig monroe hit an rbi single with one out in the 11th inning leading the detroit tigers to a wild 1110 victory over the seattle mariners on saturday night,0.0910183718023479,1
ht england 1 ukraine 0 beckham turned provided 10 minutes before the break after gerrard had been felled as he surged forward curling a freekick to the far post where neville rose to power a header straight at shovkovsky,0.0160616115897738,1
greek drugs embarrassment overshadows phelps athens reuters  greece was rocked by the threat of being  stripped of an athens games medal and the host nations team  manager offered to quit on friday as doping overshadowed  michael phelps drive to be olympic swimmings top medal  winner,0.0210078795337665,1
moody 39s raises dell 39s senior unsecured debt rating new york aug 18  moody 39s investors service said on wednesday it raised the senior unsecured debt rating of dell inc dello quote profile research with a stable outlook citing the firm 39s strong balance sheet and solid operating and financial,0.0522769148265338,2
construction driving solid product demand surging demand in heavy construction should outweigh any downturn in new home building according to onesteel and boral,0.0049432354107322,2
amp 39s h1 profit beats expectation insurer and fund manager amp ltd  on wednesday posted a betterthanexpected firsthalf profit on higher investment returns and improved margins and targeted a stronger performance for the remainder of the year,0.0500960951341641,2
bjs profit rises food gas sales strong chicago reuters  bjs wholesale club inc lta href targetstocksquickinfofullquotegtbjnltagt on  tuesday posted higher quarterly profit as soaring gasoline  prices and strong demand for food boosted sales,0.0588900239494028,2
amazon snaps up china 39s largest web retailer amazoncom says it has reached an agreement to buy joyocom the largest internet retailer of books music and videos in china in a deal worth 75 million the rapid growth of broadband access in the region makes asia a particularly,-0.0397658960093083,2
stocks higher as oil eases new york reuters  us stocks traded slightly higher on  friday even as oil flirted near the 50perbarrel mark  suggesting that investors were snatching up beatendown shares  and growing confident that oil prices may be leveling off,0.0382218091219661,2
ual wins ok for exclusivity extension reuters reuters  a us bankruptcy court judge on fridayapproved a 30day exclusivity extension for united airlinesgiving the carrier another month to file its own reorganizationplan without competing plans from creditors,0.0403550075800999,2
treasuries oil up inflation in check new york reuters  treasury debt prices rallied on  tuesday dragging yields to fourmonth lows as july inflation  figures proved subdued and soaring oil prices pointed to slower  us consumer spending down the line,0.0402117712831938,2
a personal operator from verizon verizon plans to offer a service that would act as a virtual switchboard operator letting customers stay in touch at all times the program would send phone calls voicemails and emails wherever customers designate by elisa batista,-0.0555973772861531,2
hip hops online shop celebrity fashion is booming these webpreneurs are bringing it to main street,0.1284527363924314,2
at least someone 39s winning in this war news item  quotthe us army has threatened to partially withhold payments to halliburton due to allegations of overcharges for food shelter and services quot,-0.0434463317856093,2
shippers venezuela oil unfazed by poll reuters reuters  oil exports by venezuelahave not been disturbed by the referendum on the rule ofpresident hugo chavez shipping sources said late sunday,0.0244280433258536,2
us to withhold halliburton money the pentagon is to withhold a proportion of payments to us firm halliburton which supplies meals to us troops in iraq,-0.0065184103727107,2
dallas firm interested in buying cyberonics cyberonics the maker of a device that treats epilepsy has nabbed the attention of a buyer advanced neuromodulation systems of dallas said friday it has acquired 15 percent of the company and added that it may want to buy it,-0.0112455907935475,2
google 39s ipo delayed google inc 39s initial public offering has been delayed while the company awaits final approval of its paperwork by the securities and exchange commission,0.049547776085247,2
kmart posts profit after cost cuts chicago reuters  kmart holding corp ltkmrtogt on monday  reported its third consecutive quarterly profit despite  slumping sales as it cut jobs and reduced advertising and  discounts boosting its cash pile to 26 billion,0.0322584155399465,2
power lines cost could grow 40 new york  northeast utilities  uil holdings corp  and new englands grid operator have proposed changes to a planned power line in southwest connecticut that would increase costs by more than 40 percent,0.017773863163911,2
german welfare rallies escalate eastern germany sees more mass protests over welfare cuts with smaller rallies in western cities,-0.0915974651468269,2
tokyo stocks flat in late trade tokyo reuters  tokyo stocks were flat in afternoon trade  on friday as worries about record high oil prices took the edge  off investors appetite for recently battered high tech issues  such as sharp corp,0.0456367336894302,2
nortel networks to cut 3500 toronto  nortel networks said yesterday it will slash its workforce by 3500 or 10 percent as it struggles to recover from an accounting scandal that toppled three top executives and led to a criminal investigation and lawsuits,0.0470998657027869,2
us economy leading indicators manufacturing index slow aug 19 bloomberg  the index of leading us economic indicators fell in july and philadelphiaarea manufacturing expanded at a slower pace this month signs that record energy prices are keeping growth from accelerating,0.0252389494330698,2
bhp billiton alcoa to sell shares in metal distribution unit bhp billiton the world 39s biggest mining company and alcoa inc said they plan to sell shares in their metalprocessing and distribution venture,0.0319000639997102,2
sec seen making google ipo effective washington reuters  the us securities and exchange  commission is expected to declare the initial public offering  registration of google inc lta href targetstocksquickinfofullquotegtgoogoqltagt effective after 4 pm  sources familiar with the matter said on wednesday,0.0335441231747586,2
united airlines says it may terminate pension plans update3 aug 19 bloomberg  ual corp 39s united airlines trying to attract financing to exit bankruptcy said it probably will terminate and replace all its pension plans,0.0561062188883751,2
us credithalliburton jostled by army audit backandforth new york aug 17 reuters  in an otherwise listless credit market halliburton has created some drama with its ongoing saga with the army over its accounting for 18 billion of work in iraq and kuwait,0.0298417937333317,2
sysco profit rises sales have slowed new york reuters  sysco corp ltsyyngt the largest us  distributor of food to restaurants and hospitals on monday  said quarterly profit rose as an extra week in the period and  acquisitions helped offset the effects of higher food prices,0.0486602621744856,2
making free ipods pay off the freeipodscom website looks as phony as a 3 bill in fact its at the forefront of performancebased marketing as advertisers discover its more effective to spend 50 million on gifts than to blow the cash on tv ads by leander kahney,-0.0451390542579785,2
air canada creditors clear carrier 39s bankruptcy plan update2 aug 17 bloomberg  air canada creditors including a general electric co unit and deutsche bank ag cleared a plan that gives them most of the company 39s equity when the carrier emerges from bankruptcy protection at the end of september,0.0390250857250471,2
google slashes ipo sec ok expected today new yorksan francisco reuters  google inc slashed the  size of its initial public offering nearly in half to less than  2 billion on wednesday splashing cold water on what has been  touted as the hottest internet ipo in years,0.0263720246155583,2
hurricane charley tears into outback reuters reuters  outback steakhouse inc osin ontuesday said it lost about 130 operating days and up to  362million in revenue because it had to close some restaurants inthe south due to hurricane charley,0.0410878823517732,2
hollinger inc director rohmer may leave board post reports richard rohmer a friend of conrad black and director of black 39s holding company hollinger inc may resign from the board as early as next week because he 39s tired of dealing with complex,0.0165047392039511,2
brazil finds true value of art the brazilian government and a united nations agency team up to help the country reap more financial rewards from its creative industries,-0.0001886569240687,2
court rejects movie music makers piracy claims los angeles reuters  a federal appeals court on thursday  delivered a stinging blow to the antipiracy efforts of major  movie studios and music companies ruling that several online  filesharing software companies are not liable for copyright  infringement,0.0473330268063746,2
costco is accused of sex bias n employee at the costco wholesale corporation filed a national classaction lawsuit against the company yesterday accusing it of discriminating against women in promotions to store manager,0.0367053474342183,2
tiffany  amp co selling stake in aber diamond toronto  aber diamond corp said tuesday that worldrenowned retailer tiffany  amp co has sold its 8 million shares of aber and the companies have ended their discount sales agreement,0.0815449099870743,2
profit rises at chinese mobile giant china mobile hong kong the world 39s largest cellphone operator ranked by customers said wednesday that profit rose 78 percent in the first half of this year after the company enrolled more new subscribers by offering lessexpensive services net,0.0365826934049742,2
wheres the wifi parks developer wants to know ten years ago boston real estate developer norman b leventhal spearheaded the transformation of a grungy financial district garage into a park thats become a downtown oasis,0.0397404025432405,2
audit of referendum supports chavez an audit by international observers supported official elections results that gave president hugo chavez a victory over a recall vote against him the secretarygeneral of the organisation of american states announced,-0.0492643768298886,2
confidence drops in germany investor confidence in germany europe 39s biggest economy dropped in august to the lowest level in more than a year according to data released on tuesday amid concern that record oil prices would crimp global growth and impede a recovery in consumer,0.0324177231069355,2
supermarket giant usurps title marks  amp spencer has lost its muchcoveted crown as the uks largest clothing retailer to the supermarket chain asda industry figures for the 12 weeks to 25 july show that asda now has a leading 94 per,0.046493644403169,2
japan stocks fall on oil worries tokyo reuters  tokyo 39s nikkei average fell 059 percent by midday on wednesday erasing initial gains as exporters like nissan motor co ltd declined on concern over the possible impact on the global economy of surging oil prices,0.0362812615343594,2
google 39s woes shouldn 39t bury ipo auction idea google inc 39s stumbles shouldn 39t be used to write off the idea of employing auctions to sell stock to the public certainly the initial public offering of the internet search,0.0276080019240799,2
imf says czech economic outlook  39favorable 39 washington aug 17 reuters  the international monetary fund said on tuesday the nearterm economic outlook for the czech republic a european union newcomer was favorable with growth expected to strengthen,0.0039343550180568,2
google cuts ipo price by a quarter to 8595 a share update7 aug 18 bloomberg  google inc on the eve of pricing the secondbiggest internet initial public offering slashed the value of the sale almost in half amid the worst market for us ipos in almost two years,0.0764447540953187,2
giving voice to a billion things forbescom forbescom  when robert poor looks at the world he sees 50 billion embedded microcontrollers the workhorse chips inside cars traffic lights and air conditioners doing their jobs in splendid isolation then he imagines what will happen when they all can talk to one another,-0.0800825629778422,2
lojack makes canada move with boomerang buy the westwood company is spending 48 million to acquire boomerang tracking inc a montreal company that operates a stolen car recovery system in canada,0.0509210085112293,2
coming to the rescue got a unique problem not to worry you can find a financial planner for every specialized need,0.0259269752531066,2
google cuts price range ends auction san jose california  initial shares of google inc were priced late last night at 85 us each  the low end of estimates that the company had revised downward hours earlier,0.0322799107066727,2
imf gives jamaica thumbs up the international monetary fund has praised the jamaican government for stabilizing the countrys economy,-0.005335546134525,2
chasing the suv vote sport utility vehicles roared into stump speeches this month flattening all common sense at a speech last week introducing president bush virginia 39s governor george allen juiced the crowd by,-0.0521341948610355,2
ual wins ok for exclusivity extension chicago reuters  a us bankruptcy court judge on friday  approved a 30day exclusivity extension for united airlines  giving the carrier another month to file its own reorganization  plan without competing plans from creditors,0.0334039387758011,2
parmalat to sue auditors parmalat the bankrupt italian food company is suing outside auditors grant thornton and deloitte  amp touche seeking 55 billion in damages,0.0632555710415859,2
investors see only negatives some say indexes dropped thursday because investors are idling until some good news comes around maybe so but the trading volume of the nasdaq100 tracking stock which we use to get a better feel for how individual tech shares are selling,0.0263964287876505,2
delta fare plan now seems fair delta air lines 39 decision to reduce fares out of cincinnatinorthern kentucky international airport is good news for the region but the key will be whether the airline is committed to sustaining the reasonable rates,0.0644624754313665,2
dillards loss narrows but off estimates new york reuters  dillards inc lta href targetstocksquickinfofullquotegtddsnltagt on wednesday  reported a narrower quarterly loss as it cut costs but a drop  in samestore sales caused the latest results to miss wall  streets estimates by a wide margin,0.0471023341320041,2
chain store sales growth slows new york reuters  hurricanes bonnie and charley slowed  us chain store sales growth in the latest week a report said  on tuesday,0.0954193464929254,2
scandalhit nortel to make worker cuts nortel networks plans to slash its workforce by 3500 or ten per cent as it struggles to recover from an accounting scandal that toppled three top executives and led to a criminal investigation and lawsuits,0.0358652729569405,2
air canada stock plummets on review montreal reuters  shares of air canada lta href targetstocksquickinfofullquotegtactoltagt fell by  more than half on wednesday after the toronto stock exchange  said it was reviewing the companys stock to determine if it  meets listing requirements,0.0498470462703715,2
report j ampj in talks to acquire guidant health care giant johnson  amp johnson is reportedly in advanced negotiations to acquire medical device maker guidant corp for more than 24 billion,-0.0452250290879286,2
prepare for stormy weather with a disaster file as we watched television coverage of hurricane charley last weekend my wife and i reminisced about a time nearly two decades ago when we lived in florida and got the word to evacuate,-0.03424052454799,2
metro briefs a bolingbrook firm is recalling 406000 pounds of frozen beef products that may be contaminated with e coli officials said the quantum foods beef including frozen patties and steaks were produced june 23 and 24 and distributed nationwide,0.0682583525449215,2
treasuries fall as oil retreats reuters reuters  us treasury debt prices fell onmonday as investors focused on a pullback in oil prices fromrecord highs and largely shrugged off dismal results from aregional manufacturing survey,0.027298178364687,2
sun goes down empire blows up well i had my second date with margot last week it was nice we attended a seminar on multimodal component interfaces and then went on a romantic stroll around a waste treatment facility she says the smell of methane calms her nerves i sure can pick em cant i,-0.0244291534131157,2
metlife seen near sale of hub invest unit metlife inc is in latestage negotiations to sell one of bostons oldest investment firms state street research  amp management co to another new york financial giant blackrock inc according to two executives briefed on the talks,0.0265745611294191,2
google ipo prices at 85share  source san francisco reuters  google incs googo initial  public offering of 196 million shares priced at 85 each the  low end of their projected range a source familiar with the  auction said on wednesday raising 167 billion and making it  the fourthlargest us ipo this year,0.0433313409071839,2
judges rule filesharing software legal update a federal appeals court has upheld a controversial court decision that said filesharing software programs such as grokster or morpheus are legal,-0.0268249093664372,2
bush pressing case for  39ownership society 39 amid signs that the economy is cooling president bush is showcasing initiatives for a second term under the banner of an  quotownership society quot in hopes of bolstering his economic stewardship credentials,0.007291870653984,2
audit finds no fraud in venezuelan election the referendum on aug 15 2004 rejected the petition to revoke the mandate of president hugo chavez the observation of the carter center mission confirms the results announced by the national election council,-0.0758319410229257,2
job cuts rise further in nov  report new york reuters  planned job cuts at us firms climbed  during november a report said on tuesday in a further sign of  sluggishness in the labor market,0.0608316611785091,2
us time running out in airbusboeing row paris reuters  the united states said on tuesday it may  soon take legal action in a trade row over government help for  airbus and boeing particularly as the european aircraft maker  was seeking support for a new project washington and brussels  have so far resisted launching legal action at the world trade  organization wto in their battle over allegations of illegal  subsidies to the aviation rivals but that option may now be  just weeks away,0.0090804216948915,2
nortel turns a tiny corner the canadian telecom equipment maker has issued its first postaccountingscandal financial update so far so good,0.0681116204465598,2
taiwans economy expands at fast pace ap ap  taiwans economy expanded at its fastest pace in four years during the second quarter as the global economy recovered boosting foreign trade and increasing manufacturing output the government said friday,-0.0228644067219753,2
search industry welcomes google ipo sees growth seattle aug 19 reuters  google inc googo quote profile research competitors large and small welcomed the web 39s most popular search engine into their ranks as a publicly traded company on thursday saying the search industry,0.063728260358822,2
brown shoe earnings drop 32 percent reuters reuters  brown shoe co inc bwsn onwednesday posted a 32 percent drop in quarterly earnings hurtby slack sales from its childrens unit bass wholesalebusiness and naturalizer chain,0.051252678599407,2
saudi phone sector gets 1bn lift a group led by the uaes etisalat plans to spend 1bn 544m on expansion after winning two mobile phone licences in saudi arabia,0.0184710050969803,2
gloves are off as abbey war turns dirty anyone who thought the battle for marks  amp spencer had plumbed the depths of city depravity with its stories of fisticuffs in baker street and allegations of interference with mobile phone records may have to draw breath as the banking battle gets serious,-0.0120789530957308,2
weak ice cream sales melt nestles profit reuters reuters  higher raw material costs and lower icecream sales in europe ate into nestles nesnvx firsthalfresults sending shares in the worlds largest food group downover five percent on wednesday amid concerns about itslongterm profitability,0.052758185310331,2
new hospital design aids healing cuts errors greeters direct new arrivals at the elevators wireless telephone systems and internet access are available and every guest room is private cheerful and has a foldout chairbed,-0.084572881229224,2
more big boobs in playboy an interview with googles cofounders due out in the current issue of playboy may delay the companys ipo securities regulations restrict what executives can say while preparing to sell stock for the first time,0.0282101409610186,2
dollar mired near lows after weak data london reuters  the dollar hovered near multiweek lows  on wednesday as investors questioned whether the us central  bank would raise interest rates next month in the light of  another round of weak us data,0.0344330657153822,2
