text,importance,label
swimmers gymnasts lift nbc 39s early ratings boosted by strong results from us gymnasts and swimmers nbc 39s ratings for the athens olympics 39 first four days have topped the disappointing viewership levels of the 2000 sydney games,0.0486011183191003,1
pakistan to rest speed duo skipper inzamamulhaq said he 39d likely rest shoaib akhtar and mohammad sami for tuesday 39s limitedovers match against an australian chairman 39s xi as pakistan continues to ease its pace bowlers into the tour,0.0741212894522308,1
aussies battle americans to 11 tie ap ap  after 17 years the matildas finally caught up to the us womens soccer team joanne peters 12yard header in the 82nd minute gave australia a 11 tie tuesday with the united states breaking a 15game aussie losing streak that dates to the teams first meeting in 1987,0.047403776452201,1
springboks beat australia in trnations rugby south africa has defeated australia in the final match of the rugby tri nations series africa correspondent sally sara reports the springboks won 23 to 19 in front of a home crowd in durban,0.0137889499936409,1
giddens earns us silver in kayaking rebecca giddens made a final charge that nearly landed her a gold medal but in the end the american settled for silver in yesterdays kayaking single slalom,0.0835794592242247,1
chronology of key events in kobe bryant ap ap  timeline of the sexual assault case against los angeles lakers star kobe bryant,0.0385376395734105,1
supporters now have to wait to see nunez he 39s the man seemingly noone in liverpool knows anything about  and who 39ll now have to wait a little longer before attempting to endear himself to a curious anfield crowd,0.0702592111012373,1
ravens wait for sanders while deion sanderss return appears more and more imminent the major remaining question is when the former star will join the baltimore ravens,-0.0540789790946764,1
us rowers advance americans aquil abdullah and henry nuzum row their double scull furiously down the stretch to cross the line in a dead heat with norway on wednesday winning both teams a spot in a rare sevenboat final,0.0600803041196546,1
entries just cant keep pace as expected none of the four united states entries survived yesterdays second set of olympic rowing semifinals leaving just four boats  the mens and womens eights the mens double sculls and the womens quadruple sculls  going for medals this weekend five fewer than in sydney four years ago,0.068681378646317,1
new york mets team report  august 22 sports network  matt ginter will get the start for an injured victor zambrano this afternoon when the new york mets conclude their threegame series with the san francisco giants at sbc park,0.0812517283304908,1
relaxed atmosphere lifts moore list into final at the us amateur players wear shorts and spectators get to walk right down the fairways so compared with the us open which is run by the same outfit everything about this championship is decidedly relaxed,0.032157377894938,1
singh snares pga title vijay singh outlasts justin leonard and chris dimarco in a threeway playoff to win the pga championship on sunday at whistling straits in haven wisconsin,0.0669870396614822,1
south africa 23  19 australia when percy montgomery sent his third and last penalty of the afternoon sailing between the uprights to take south africa out to 237 after 63 minutes it seemed safe to contemplate the remarkable idea that south africa were to be tri nations champions,0.0681612080837372,1
tcu louisville try to leave cusa champs ap ap  tcu helped change the bowl championship series even though its season ended at home the horned frogs won their first 10 games last season and reached sixth in the bcs standings the highest ranking for a team not in one of the bcs conferences a loss at southern miss ended tcus bid of becoming the first bcs outsider to break into a bigmoney bowl game that also cost the frogs the conference usa title and sent them to the inaugural fort worth bowl,0.029299119155541,1
dyer up for sale on ebay the 23yearold midfielder has been all over the back pages this week following a reported bustup with sir bobby robson  and one supporter had has enough,0.0531544288588256,1
american swimmers fired up by relay win athens reuters  the us swimming team was slow off the  blocks but is heading for home at full speed propelled by  tuesdays dramatic relay victory us womens head coach mark  schubert said on wednesday,0.0887649409728488,1
gymnast khorkina says judges robbed me moscow reuters  russias svetlana khorkina who was  second to american carly patterson in the womens allround  gymnastics competition has accused the judges of robbing her  of the gold medal and said everything was decided in advance,0.0461679582303831,1
raiders 39 revamped defense still needs tinkering an online scouting service recently rated the dallas cowboys in a tie with the 49ers as the second leasttalented offense in the nfl,0.0330275187480762,1
athletics suspended judge lives near hamm athens  the colombian judge suspended for giving south korea 39s yang taeyoung an incorrect score in the olympic men 39s allround event lives in gold medallist paul hamm 39s home state international gymnast magazine reported on sunday,0.0573356349728724,1
us gymnasts double the gold athens greece  twenty years ago in los angeles it was mary lou retton and the vault without fault,0.0866425216362181,1
hewitt advances lleyton hewitt of australia moved into the quarterfinals of the legg mason tennis classic with a 63 62 victory over alejandro falla of colombia in washington,-0.0475049698892973,1
raiders gallery misses camp with injury ap ap  left tackle robert gallery the second player taken in the nfl draft didnt practice tuesday morning with the oakland raiders because of an elbow injury leaving his status uncertain for saturdays preseason game against dallas,0.0880011461886344,1
soccer real wanted england international woodgate despite injury london  england international defender jonathan woodgate real madrid 39s new recruit from newcastle will be out of action for a month but that did not deter the spanish giants from signing him,-0.0108578205765232,1
arsenal equal record arsenal came back from two goals down to equal nottingham forest 39s 42match unbeaten run that has stood for 25 years the gunners went ahead in the 26th minute through thierry henry but arsenal were stunned,0.1048118831394717,1
puerto rico stuns us in opening round puerto rico upsets the united states 9273 at the mens basketball preliminaries on sunday the first loss at the games for the threetime defending gold medalists since 1988,0.0859469785561302,1
cink increases lead in ohio usa ryder cup wildcard stewart cink increased his lead to five shots after three rounds of the wgc invitational at the firestone country club in ohio,0.0514701309206376,1
tennessee may start freshman qb in opener ap ap  erik ainge and brent schaeffer are trying to accomplish a feat that even peyton manning couldnt pull off at tennessee  151 start at quarterback in the seasonopener as a freshman,-0.0276519927642095,1
10 seconds that change everything athens  ten seconds barely time enough to tie a shoe wash a glass get the paper off the porch but when the moment comes and eight men kneel at their blocks and peer down the empty waiting track it is as if the entire olympics stop to watch,0.0665747731881569,1
one gamble bears really had to take the bears traded marty booker to miami for adewale ogunleye because they had no choice but to do so talent levels being equal a defensive end is more valuable than a wide receiver,0.0015553889556328,1
olympics  japan 39s kitajima completes breaststroke double athens  kosuke kitajima completed a sweep of olympic breaststroke gold on wednesday capturing the 200m title in a games record ahead of hungarian teenager daniel gyurta,0.0771996550535869,1
greek athlete tests positive athens greece sports network  a member of the greek olympic team has tested positive for a banned substance this according to a news bulletin released by the hellenic olympic committee on friday,0.0715155792009667,1
russia blocks bid by us russia is one of the biggest most powerful mens volleyball teams in the world already well aware the united states received another reminder,0.0205118016738854,1
northern ne reaches peak with some late heroics northern new england knocked off undefeated north shore 32 in the championship game of the hockey night in boston summer showcase at merrimack college last night,0.0904277965448947,1
pinsent victory sparks gold rush rower matthew pinsent has won a fourth consecutive olympic gold medal in the coxless four while britain picked up further gold medals in the sailing cycling and threeday eventing,0.091140510735937,1
usa women pass first big test spain athens  the usa women 39s basketball team sailed through their first three games as though they were on a mediterranean cruise trouncing opponents by more than 30 points a game,0.0356835708631026,1
blackhawks resign defenseman berard chicago ill sports network  the chicago blackhawks  monday agreed to terms on a oneyear contract with defenseman  bryan berard as per team policy financial terms of the deal  were not disclosed,0.0418259422776802,1
hamilton takes gold in time trial athens greece  the united states took gold and bronze in the men 39s olympic cycling individual time trial on wednesday with tyler hamilton topping the podium and his team bobby julich finishing third,0.1102515590694262,1
yankees are powerless and stadium was too the big scoreboards at yankee stadium went dark in the seventh inning friday night not that the yankees were lighting them up anyway,0.0986002685200137,1
uae joins olympics gold medal winners uae joins olympics gold medal winners abu dhabi 18 aug 04 wam  a uae paper said today that sheikh ahmed bin hashar al maktoum 39s winning of the gold medal in double trap shooting had taken the uae to the pinnacle of sporting glory at the olympics,0.0683309815756756,1
saulnier looking strong cyril saulniers 63 76 victory over gilles elseneer on wednesday continues a recent trend of superb play for the 29yearold frenchman,0.0727968884257895,1
in a flash escobedos dream is over athens  vicente escobedo learned a hard lesson yesterday at peristeri boxing hall he learned you have to be ready when your moment arrives or you will chase your dream all night without ever reaching it,0.0155924423378309,1
cowboys 43 seahawks 39 jones had 198 yards rushing and three touchdowns helping dallas erase a 10point deficit with less than three minutes to play as the visiting cowboys stunned the seattle seahawks 4339 last night,0.0090751316012732,1
sampanis stripped of bronze greek weightlifter leonidas sampanis is stripped of his bronze medal after testing positive for drugs,0.0739110151238373,1
al wrap santana solid on mound as twins beat yankees new york reuters  johan santana pitched seven strong  innings to win his fifth straight start and shannon stewart  homered had three hits and two rbi to lead the minnesota twins  to a 72 home win over the new york yankees,0.0384102142910624,1
lewis drops off pace denise lewis makes a stuttering start to the heptathlon as fellow briton kelly sotherton storms into second place,0.0977230225833762,1
our swimming saviours a fast finish in the pool at athens has delivered australia 39s best swimming medal haul since the 1956 melbourne games a heroic butterfly leg from petria thomas in the women 39s medley relay yesterday snared the team 39s seventh and final gold medal,0.035364563241737,1
nl wrap johnson fans 14 mets as arizona snaps slide new york reuters  randy johnson struck out 14 batters in  8 13 innings to help the arizona diamondbacks end a ninegame  losing streak with a 20 win over the new york mets on sunday,0.0763512514072684,1
phelps adds 200medley to his tally of gold athens  michael phelps certainly will not beat mark spitz 39s record seven olympic swimming gold medals in munich in 1972 but the american youngster is still racking up the gold in athens,0.0451334380403853,1
hearn earns first nationwide tour victory ap ap  david hearn of canada earned his first nationwide tour victory sunday closing with a 1under 71 and beating david mckenzie by a stroke at the alberta classic,0.1240438131620793,1
olympic games hit stride with medals freeforall athens reuters  norway germany france britain  romania new zealand and australia all looted the goldmedal  chest in the athens olympic rowing basin on saturday as greece  counted the cost of the games in national pride and treasure,0.0717307803711148,1
us nba stars pushed to the brink before edging greece afp afp  allen iverson scored 17 points despite a fractured right thumb and the reeling united states team was pushed to the brink before beating greece 7771 in an olympic preliminary round basketball game,0.0716848121091579,1
green bay packers green bay wisconsin ticker  darren sharper returned one his team 39s three interceptions 90 yards for a touchdown leading the green bay packers to a 1914 preseason victory over the new orleans saints,0.0605211996705406,1
security officials relieved vigilant athens aug 19  worried about the potential for a terrorist catastrophe greece is spending about 15 billion on security for the olympic games the biggest threats so far foreign journalists and a canadian guy dressed in a tutu,0.0203189289707492,1
wambach 39s boot boosts us into semifinals abby wambach will never score an easier goal from 1 foot away she tapped the ball into the net and put the united states into the olympic semifinals,0.0773568832018913,1
court throws out challenge to blimp the united states is on the verge of winning its first fencing medal in twenty years  greek sprinters kostas kenteris and katerina thanou are out of the hospital but not out of the woods,0.0096236448449997,1
olympic games the first olympic games were dedicated to the olympian gods and were staged on the ancient plains of olympia famous for its magnificent temples of the gods zeus and hera take the rediff business quiz and find out what role the corporates play in the,0.0499004575030269,1
mlb los angeles 7 atlanta 4 shawn green hit two home runs saturday including a grand slam to lead the los angeles dodgers to a 74 victory over the atlanta braves,0.1363197806289296,1
injuries continue to bedevil cardinals ap ap  arizona cardinals defensive tackle kenny king needs surgery on his right wrist and probably will miss the season the latest hit to a team struggling with injuries,0.0288821992291925,1
hochschorner brothers win c2 gold pavol and peter hochschorner took the gold medal once again in pairs canoe slalom friday winning by more than 3 seconds,0.0683052738621221,1
miami struggles on offense the redskins on saturday will face a dolphins team facing a number of issues on offense,0.0042726319504395,1
absent phelps gets eighth medal athens reuters  michael phelps got his eighth medal at  the athens olympics saturday without even getting wet when the  united states broke the world record in the mens 4x100 meters  medley relay,0.0941294302818054,1
us men take gold and bronze in cycling time trial athens reuters  the united states proved there is more to their cycling team than lance armstrong by taking gold and bronze in the men 39s olympic individual time trial at the athens games wednesday,-0.0203958280437939,1
roddick escapes federer doesn 39t at olympics andy roddick and roger federer both found themselves mired in threeset struggles tuesday night at the olympics,-0.015177569024019,1
ruling likely ends blooms college football career the ncaa has denied jeremy blooms request to play football at colorado while accepting endorsements to support his skiing career,-0.0569337021218975,1
hewitt thunders to final lleyton hewitt advanced to the finals of the legg mason tennis classic with a 63 64 win over robby ginepri on saturday,0.0882228546045279,1
twins collect rare victory over yankees minneapolis ap  brad radke pitched seven solid innings corey koskie drove in three runs and the minnesota twins beat the new york yankees in the regular season for the first time since 2001 with an 82 victory tuesday night,0.0987273922489856,1
owners players talk but nothing resolved five hours of talks tuesday brought owners and players no closer to resolving labor disagreements that will lead to a lockout when the collective bargaining agreement ends sept 15,0.0472482536023321,1
alonso next in at anfield rafael benitez 39s anfield revolution gathered pace today when the liverpool manager unveiled one new signing and revealed he was close to completing a deal for another,0.0856700469494601,1
phelps wins fourth gold at athens olympics athens aug 19 xinhuanet  michael phelps won his fourth gold medal at the olympic games in the men 39s 200m individual medley here on thursday,0.1175803936657072,1
hungarian gp friday roundup fernando tenth and jarno seventeenth but no cause for concern while pat symonds explains the challenges of fridays at the race,-0.0864924047699999,1
berths in semifinals for two americans on aquacolored walls and giant blue columns patricia miranda saw all she needed to see the message was written in white inside ano liossia olympic hall even next to the wrestling mats in case anyone forgot,0.0587023955215353,1
five more suspended by weightlifting body athens  weightlifting 39s aggressive pursuit of drug cheaters will continue even if it jeopardizes its future in the olympics its top official said yesterday after six more positive doping cases in what is again becoming the games 39 dirtiest sport five,0.001622507480731,1
controversy again taints olympic games athens greece  bad judging has become a tradition at the olympics almost its own event really from the robbery of munich where officials stole a basketball gold from the united states and gave it to russia,0.0767485750828699,1
teen is first black national usta champion ap ap  scoville jenkins a 17yearold from atlanta became the first black to win the 18s singles championship of the us tennis association boys nationals,0.0848676246827082,1
different world newport vt  lisa klefos cant quite remember whether it was city life that drove her out of boston or the beauty of vermonts northeast kingdom that drew her upcountry it was either a combination of  quotdrivers politics and taxes quot that made it time for her to leave or it is the overwhelming beauty of the lake memphremagog region she,-0.0199628726555534,1
olympics japan sneak through to win mens team gold athens reuters  japan revived memories of their glorious  gymnastics past when they upstaged favorites china and united  states to snatch the olympic mens team gold for the first time  in 28 years monday,0.035994997125843,1
al wrap paul guerrero erstad homers guide angels new york reuters  josh paul vladimir guerrero and darin  erstad hit multirun homers to lead the anaheim angels to a  107 victory over the tampa bay devil rays in st petersburg on  thursday,-0.0042304702681514,1
how michigan athletes fared at the olympics olympic events involving athletes and coaches with connections to michigan all listed are on team usa unless otherwise indicated andre dirrell of flint advanced into the boxing quarterfinals needing,-0.0339054660551522,1
historic return but how much has it all changed the occasion was clearly too much for kristin heaton the first athlete for 1611 years to compete at the original olympic games venue of olympia the american opened the women 39s shot put competition yesterday but could not,0.0339336003254602,1
fourinrow to davenport american lindsay davenport won her fourth consecutive title of the year today beating second seed vera zvonareva 63 62 in the final of the cincinnati open,0.1275106358315793,1
greece shamed again at their own games athens reuters  the greeks were shamed again at their  own olympics on sunday when bronze medal weightlifter leonidas  sampanis was kicked out after failing a dope test,0.0770608788362688,1
shot put earns a dubious distinction as first and last test ltbgtltbgt the executive board of the ioc will meet at 5am for the second day running this time to take away the women 39s shot put gold medal from russian irina korzhanenko,0.0742283254712402,1
faulds folds as al maktoum triumphs the family name alone al maktoum offered more than a scintilla of suspicion that we could expect something special never mind that victory normally materialises in the form of blueblooded bloodstock rather from the barrel of,-0.0277299033124452,1
athletes cheat way to fame and fortune dozens perhaps hundreds of major league baseball players have taken steroids in the last few years yet no player has ever been suspended for steroid use,0.0606209879699508,1
hamiltons career highlights won 1999 tour of denmark finished 10th in individual time trial in 2000 olympics at sydney,0.0944073257074634,1
greek weightlifter stripped of olympic medal ejected from athens ltbgtltbgt the international olympic committee has stripped a greek weightlifter of his bronze medal and expelled him from the athens games for a doping offense,0.0368948425332541,1
america 39s great hope in 1500 can 39t make it out of first round alan webb who was supposed to end america 39s streak of mediocrity in middledistance races got outmaneuvered and outrun as he failed to make it out of the preliminary round in the 1500 meters,0.0063636319983479,1
chilean beats dent for tennis bronze it 39s safe to say justine heninhardenne is back on top of her game she 39s healthy for the first time in months  and has a gold medal to prove it,0.0750317933080888,1
listen to greene roar athens  maurice greene flexed his arms thumped his chest and gathered the media for a postrace announcement  quotwe 39re going to have a party tomorrow and everybody 39s invited  i 39m buying quot said the defending,0.0603615960193762,1
watson holdout ends after an 18day holdout during which he parted ways with his second agent imgs tom condon  who replaced darrell wills  formerly of img but now decertified and hired a third  pat dye jr  firstround pick benjamin watson signed a sixyear contract and reported to training camp yesterday,0.0353970757178767,1
ulmer wins gold in cycling athens greece sports network  sarah ulmer of new zealand won the women 39s individual pursuit competition in track cycling sunday at the olympics,0.1128967156818247,1
ralstons position whatever it takes foxborough  steve ralston will be in the revolutions starting lineup tonight against kansas city but his position is a mystery ralston has played more mls games 271 than anyone until recently nearly all of those matches in the same role but ralston has moved into three midfield positions and displayed some of his most impressive performances at right back,-0.0033920346157271,1
fernando alonso a job well done the spaniard didnt quite repeat last years achievement but his hungarian podium left him satisfied all the same,0.1172403399598411,1
olympics federer crashes but roddick survives olympic scare athens  world no 1 roger federer of switzerland crashed out of the olympic tennis tournament when he lost to unseeded tomas berdych of the czech republic,0.1012819473603836,1
schumacher triumphs as ferrari clinches title budapest reuters  michael schumacher cruised to a record  12th win of the season in the hungarian grand prix on sunday to  hand his ferrari team a sixth successive constructors title,0.0473492529333133,1
south africa ends phelps gold medal quest athens reuters  south africa ruined michael phelpss  dream of winning a record eight gold medals in a dramatic and  controversial day of swimming at the athens olympics on sunday,0.0760401392773268,1
japans ueno pitcher perfect vs china athens  yukiko ueno pitched the first perfect game in olympic softball history leading japan to a 20 win over china yesterday and a spot in the semifinals,0.1016771041991792,1
liverpool set for flurry of transfers rafael benitez could continue the flurry of activity at anfield before the transfer window closes at the end of the month,0.0608428960489343,1
usc starts at the top southern california greeted news of its first preseason no 1 ranking since 1979 with ambivalence,0.1455782510751682,1
worstcase scenario comes to pass for us tennis secondranked andy roddick overplayed this summer and hasn 39t scored a big win since march and for the first time since she became a legitimate pro fourtime grand slam champion venus williams has become vulnerable to anyone inside of the top 40,0.0733989756980967,1
game day recap saturday august 21 but desi relaford 39s ninthinning drive with two runners on and two out settled into the glove of right fielder gary matthews jr,0.0765168625351084,1
federer 39s games dream shattered athens reuters  roger federer was bundled out of the olympic tennis tournament tuesday by unheralded czech tomas berdych,0.0292962162944676,1
big indian dream comes crashing down two positive drug tests and leander paes and mahesh bhupathi playing as if they were on tranquilisers india had a nightmare day at the olympics today,0.0098048393052348,1
czech coach hlinka dies in car accident ap ap  czech republic national ice hockey team coach and former pittsburgh penguins coach ivan hlinka died monday after sustaining serious injuries in a car crash an official said,0.0379955724310008,1
americans bounce back athens  allen iverson scored 17 points even with the broken thumb on his shooting hand as the united states rebounded from a shocking openinggame loss to beat greece 7771 at the men 39s olympic basketball tournament yesterday,0.1077843743135215,1
us men squander lead but hold off thorpe to win athens aug 17  rarely has a huge lead disappeared so quickly largely unheralded us swimmer klete keller jumped in the pool for the final leg of the 4x200meter freestyle relay a secondandahalf ahead of australian legend ian thorpe,0.0463867065541318,1
